{
  "schema_version": "2.2.0",
  "run_id": "11111111-1111-4111-8111-111111111111",
  "issue_key": "TICKET-1234",
  "app_folder": "C:\\src\\app",
  "run_dir": "C:\\src\\app\\.cursor\\foundry\\runs\\11111111-1111-4111-8111-111111111111",
  "state_path": "C:\\src\\app\\.cursor\\foundry\\runs\\11111111-1111-4111-8111-111111111111\\state.json",
  "config_path": "C:\\src\\app\\.cursor\\foundry\\runs\\11111111-1111-4111-8111-111111111111\\config.json",
  "foundry_cli": "python foundry.py",
  "current_step": "plan.research",
  "interaction_mode": "interactive",
  "unit_relative": ".cursor/foundry/steps/plan-research.md",
  "task_subagent_type": "codebase-researcher",
  "subagent_mode": "implementation",
  "blocked": null,
  "open_subagent_launches": [],
  "feature_branch": null,
  "feature_branch_head": null,
  "session_stop_hint": "stop_after_worker",
  "gate_policy": {
    "kind": "none",
    "auto_eligible": false,
    "auto_decision": null,
    "prompt_key": null
  },
  "valid_intents": ["resume"],
  "inputs": { "approved_ac_version": 1 },
  "forbidden": ["load_full_events_jsonl"],
  "steward_allowlist": {},
  "worker_launch_contract": ".cursor/foundry/docs/worker-launch-contract.md",
  "next_commands": ["python foundry.py worker launch-packet --state state.json"],
  "handoff_blurb": "Research the approved scope."
}
